{
  "$schema": "https://json-schema.org/draft/2020-12/schema",
  "$id": "progress-report-packet.schema.json",
  "type": "object",
  "additionalProperties": false,
  "required": ["taskId", "reason", "summary", "actorId", "sessionId", "plainLanguage", "nextActions"],
  "properties": {
    "taskId": {"type": ["string", "null"]},
    "reason": {"type": "string", "minLength": 1},
    "summary": {"type": "string", "minLength": 1},
    "actorId": {"const": "coordinator"},
    "sessionId": {"type": "string", "minLength": 1},
    "plainLanguage": {
      "type": "object",
      "additionalProperties": false,
      "required": ["projectPurpose", "whatWasDone", "whatWorksNow", "whatStillDoesNotWork", "userImpact", "canContinue", "canRelease"],
      "properties": {
        "projectPurpose": {"type": "string", "minLength": 1},
        "whatWasDone": {"type": "string", "minLength": 1},
        "whatWorksNow": {"type": "string", "minLength": 1},
        "whatStillDoesNotWork": {"type": "string", "minLength": 1},
        "userImpact": {"type": "string", "minLength": 1},
        "canContinue": {"type": "string", "minLength": 1},
        "canRelease": {"type": "string", "minLength": 1}
      }
    },
    "nextActions": {
      "type": "array",
      "minItems": 3,
      "maxItems": 3,
      "allOf": [
        {"contains": {"properties": {"type": {"const": "RECOMMENDED"}}}, "minContains": 1, "maxContains": 1},
        {"contains": {"properties": {"type": {"const": "ALTERNATIVE"}}}, "minContains": 1, "maxContains": 1},
        {"contains": {"properties": {"type": {"const": "OPEN"}}}, "minContains": 1, "maxContains": 1}
      ],
      "items": {
        "type": "object",
        "additionalProperties": false,
        "required": ["type", "statement", "impact", "risk", "humanEffort", "sourceRefs"],
        "properties": {
          "type": {"enum": ["RECOMMENDED", "ALTERNATIVE", "OPEN"]},
          "statement": {"type": "string", "minLength": 1},
          "impact": {"type": "string", "minLength": 1},
          "risk": {"type": "string", "minLength": 1},
          "humanEffort": {"type": "string", "minLength": 1},
          "sourceRefs": {"type": "array", "minItems": 1, "items": {"type": "string", "minLength": 1}}
        }
      }
    }
  }
}
